{
  "$schema": "https://libraries.horizon36596.org/zenith/schema/v1/trajectory.json",
  "formatVersion": 1,
  "kind": "trajectory",
  "season": "biobuzz",
  "alliance": "RED",
  "title": "MeepMeep line and turn",
  "source": { "planner": "MeepMeep 0.1.7 with RoadRunner 1.0", "exporter": "ZenithTrajectoryExport 1" },
  "frame": { "preset": "roadrunner" },
  "rateHz": 10.0,
  "poses": [
    [63.0000, -40.0000, 3.141593],
    [62.8500, -40.0000, 3.141593],
    [62.4000, -40.0000, 3.141593],
    [61.6500, -40.0000, 3.141593],
    [60.6000, -40.0000, 3.141593],
    [59.2500, -40.0000, 3.141593],
    [57.6000, -40.0000, 3.141593],
    [55.6500, -40.0000, 3.141593],
    [53.4000, -40.0000, 3.141593],
    [50.8500, -40.0000, 3.141593],
    [48.0000, -40.0000, 3.141593],
    [45.1500, -40.0000, 3.141593],
    [42.6000, -40.0000, 3.141593],
    [40.3500, -40.0000, 3.141593],
    [38.4000, -40.0000, 3.141593],
    [36.7500, -40.0000, 3.141593],
    [35.4000, -40.0000, 3.141593],
    [34.3500, -40.0000, 3.141593],
    [33.6000, -40.0000, 3.141593],
    [33.1500, -40.0000, 3.141593],
    [33.0000, -40.0000, 3.141593],
    [33.0000, -40.0000, 3.141593],
    [33.0000, -40.0000, 3.141593],
    [33.0000, -40.0000, 3.141593],
    [33.0000, -40.0000, 3.141593],
    [33.0000, -40.0000, 3.141593],
    [33.0000, -40.0000, -3.136357],
    [33.0000, -40.0000, -3.120649],
    [33.0000, -40.0000, -3.094469],
    [33.0000, -40.0000, -3.057817],
    [33.0000, -40.0000, -3.010693],
    [33.0000, -40.0000, -2.953097],
    [33.0000, -40.0000, -2.885029],
    [33.0000, -40.0000, -2.806489],
    [33.0000, -40.0000, -2.717478],
    [33.0000, -40.0000, -2.617994],
    [33.0000, -40.0000, -2.513274],
    [33.0000, -40.0000, -2.408554],
    [33.0000, -40.0000, -2.303835],
    [33.0000, -40.0000, -2.199115],
    [33.0000, -40.0000, -2.094395],
    [33.0000, -40.0000, -1.994911],
    [33.0000, -40.0000, -1.905900],
    [33.0000, -40.0000, -1.827360],
    [33.0000, -40.0000, -1.759292],
    [33.0000, -40.0000, -1.701696],
    [33.0000, -40.0000, -1.654572],
    [33.0000, -40.0000, -1.617920],
    [33.0000, -40.0000, -1.591740],
    [33.0000, -40.0000, -1.576032],
    [33.0000, -40.0000, -1.570796]
  ],
  "boundingBox": { "lengthIn": 18.0000, "widthIn": 18.0000, "provenance": "SET BY HAND: MeepMeep setDimensions(18, 18)" }
}
