{
  "$schema": "https://libraries.horizon36596.org/zenith/schema/v1/trajectory.json",
  "formatVersion": 1,
  "kind": "trajectory",
  "season": "biobuzz",
  "alliance": "RED",
  "title": "Pedro-frame drive north",
  "source": {
    "planner": "hand-written fixture"
  },
  "frame": {
    "preset": "pedro"
  },
  "rateHz": 20,
  "poses": [
    [
      30.75,
      7.75,
      90.0
    ],
    [
      30.75,
      8.75,
      87.0
    ],
    [
      30.75,
      9.75,
      84.0
    ],
    [
      30.75,
      10.75,
      81.0
    ],
    [
      30.75,
      11.75,
      78.0
    ],
    [
      30.75,
      12.75,
      75.0
    ],
    [
      30.75,
      13.75,
      72.0
    ],
    [
      30.75,
      14.75,
      69.0
    ],
    [
      30.75,
      15.75,
      66.0
    ],
    [
      30.75,
      16.75,
      63.0
    ],
    [
      30.75,
      17.75,
      60.0
    ],
    [
      30.75,
      18.75,
      57.0
    ],
    [
      30.75,
      19.75,
      54.0
    ],
    [
      30.75,
      20.75,
      51.0
    ],
    [
      30.75,
      21.75,
      48.0
    ],
    [
      30.75,
      22.75,
      45.0
    ],
    [
      30.75,
      23.75,
      42.0
    ],
    [
      30.75,
      24.75,
      39.0
    ],
    [
      30.75,
      25.75,
      36.0
    ],
    [
      30.75,
      26.75,
      33.0
    ],
    [
      30.75,
      27.75,
      30.0
    ],
    [
      30.75,
      28.75,
      27.0
    ],
    [
      30.75,
      29.75,
      24.0
    ],
    [
      30.75,
      30.75,
      21.0
    ],
    [
      30.75,
      31.75,
      18.0
    ],
    [
      30.75,
      32.75,
      15.0
    ],
    [
      30.75,
      33.75,
      12.0
    ],
    [
      30.75,
      34.75,
      9.0
    ],
    [
      30.75,
      35.75,
      6.0
    ],
    [
      30.75,
      36.75,
      3.0
    ],
    [
      30.75,
      37.75,
      0.0
    ],
    [
      30.75,
      37.75,
      0
    ],
    [
      30.75,
      37.75,
      0
    ],
    [
      30.75,
      37.75,
      0
    ],
    [
      30.75,
      37.75,
      0
    ],
    [
      30.75,
      37.75,
      0
    ],
    [
      30.75,
      37.75,
      0
    ],
    [
      30.75,
      37.75,
      0
    ],
    [
      30.75,
      37.75,
      0
    ],
    [
      30.75,
      37.75,
      0
    ],
    [
      30.75,
      37.75,
      0
    ]
  ],
  "boundingBox": {
    "lengthIn": 17,
    "widthIn": 16.5,
    "centreOffsetIn": {
      "xIn": 0.5,
      "yIn": 0
    },
    "provenance": "SET BY HAND: fixture"
  },
  "phases": [
    {
      "startS": 0,
      "endS": 1.5,
      "label": "drive"
    },
    {
      "startS": 1.5,
      "endS": 2,
      "label": "collect"
    }
  ],
  "claims": [
    {
      "elementId": "gardenRed0",
      "action": "take",
      "atS": 1.8
    }
  ],
  "envelopes": [
    {
      "startS": 1.5,
      "endS": 2,
      "polygon": [
        {
          "x": 20.75,
          "y": 27.75
        },
        {
          "x": 40.75,
          "y": 27.75
        },
        {
          "x": 40.75,
          "y": 47.75
        },
        {
          "x": 20.75,
          "y": 47.75
        }
      ]
    }
  ]
}
